编号,食品分类,最大使用量,备注
09.2.2,冷冻拖面糊的鱼，鱼片，和鱼制品，包括软体动物，甲壳类和棘皮类动物,良好生产规范,注释XS166,注释139
09.2.1,冷冻的鱼，鱼片，和鱼制品，包括软体动物，甲壳类和棘皮类动物,良好生产规范,注释XS312,注释XS191,注释XS36,注释XS315,注释XS92,注释308,注释XS95,注释XS190,注释XS165,注释392
04.1.1.3,去皮或切块的新鲜水果,良好生产规范
13.2,婴幼儿的补充食品,200 mg/kg,注释317,注释239
06.4.2,干面制品、面条及其类似产品,200 mg/kg,注释256
14.1.2.1,果汁,良好生产规范
14.1.3.1,水果浆,良好生产规范
14.1.2.3,浓缩果汁,良好生产规范,注释127
14.1.3.3,浓缩水果浆,良好生产规范,注释127
08.1.2,碎的鲜畜、禽肉和野味,良好生产规范,注释281
13.1.2,较大婴儿配方食品,50 mg/kg,注释72,注释315,注释70
09.1.2,鲜软体动物，甲壳类和棘皮类动物,良好生产规范,注释XS312,注释XS315,注释390